<?xml version="1.0" encoding="ISO-8859-1" ?>
    <configuration xmlns:xsi="http://www.w3.org/2001/XMLSchema-instance" xsi:noNamespaceSchemaLocation="configuration.xsd">
    <notInspect>
        <class name="java.lang.Object">
            <constructor>
                <arguments/>
            </constructor >
        </class>
        <class name="java.lang.Integer">
            <method name="intValue">
                <arguments/>
                <return>
                	<primitiveType name="int"/>
                </return>
            </method>
        </class>
        <pattern>org.*</pattern>
    </notInspect>
</configuration>
